{
  "case_id": "SP16-V17-DEMO-001",
  "standard": "СП 16.13330.2017 «Стальные конструкции»",
  "action": "built_up_beam_flange_connections",
  "clause_14_4_applicability_confirmed": true,
  "transverse_shear_force_n": 240000.0,
  "flange_static_moment_mm3": 1200000.0,
  "gross_section_moment_inertia_mm4": 800000000.0,
  "concentrated_load_n": 100000.0,
  "load_factor_gamma_f": 1.2,
  "local_load_factor_gamma_f1": 1.1,
  "effective_distribution_length_mm": 250.0,
  "nominal_load_character": "stationary",
  "loaded_flange": "upper",
  "transverse_stiffener_at_load": false,
  "web_edge_planed_to_loaded_upper_flange": true,
  "weld_line_count": 2,
  "weld_coefficient_beta_f": 0.8,
  "weld_coefficient_beta_z": 1.0,
  "weld_leg_mm": 8.0,
  "weld_metal_design_resistance_n_mm2": 240.0,
  "fusion_boundary_design_resistance_n_mm2": 215.0,
  "working_condition_factor": 1.0,
  "bolt_pitch_mm": 80.0,
  "friction_plane_capacity_n": 25000.0,
  "friction_plane_count": 2,
  "full_penetration_through_web_thickness": false,
  "sheet_section_force_capacity_n": 500000.0,
  "attachment_segment": "beyond_theoretical_cutoff"
}
